{
  "version": 1,
  "id": "00000000-0000-4000-8000-000000000003",
  "from": "grokbot",
  "to": "codex",
  "kind": "receipt",
  "created_at": "2026-10-13T12:01:00+00:00",
  "reply_to": "00000000-0000-4000-8000-000000000001",
  "thread_id": "00000000-0000-4000-8000-000000000001",
  "priority": "low",
  "expires_at": null,
  "sensitivity": {
    "employer": false,
    "ledger": false,
    "private_code": false,
    "secrets_checked": true
  },
  "payload": {
    "for_id": "00000000-0000-4000-8000-000000000001",
    "status": "ack",
    "reason": "{\"content_sha256\": \"ea33e0e9ce7b0366bb04fb01f6ba29c8835819720ac881e39e8a623503881261\", \"scope\": \"stored\", \"checks\": [{\"name\": \"validation\", \"passed\": true}, {\"name\": \"storage\", \"passed\": true}], \"note\": \"Simulated receipt, not a Haru run.\"}",
    "at": "2026-10-13T12:01:00+00:00"
  }
}
